corpus,doc_id,sent_id,eg_id,index,text,text_w_pairs,seq_label,pair_label,context,num_sents
because,wsj_1506.ann,28,0,because_wsj_1506.ann_28_0,"In addition, both administration and congressional officials said the need for guidelines on coups and assassinations was partly spurred by a White House desire to avoid nasty overseas surprises during the election campaign.","In addition, both administration and congressional officials said <ARG1>the need for guidelines on coups and assassinations</ARG1> was partly spurred by <ARG0>a White House desire to avoid nasty overseas surprises during the election campaign</ARG0>.",1,1,,1
because,wsj_1506.ann,28,1,because_wsj_1506.ann_28_1,"In addition, both administration and congressional officials said the need for guidelines on coups and assassinations was partly spurred by a White House desire to avoid nasty overseas surprises during the election campaign.","In addition, both administration and congressional officials said the need for guidelines on coups and assassinations was partly spurred by a White House desire to <ARG1>avoid nasty overseas surprises</ARG1> during <ARG0>the election campaign</ARG0>.",1,1,,1
because,wsj_1506.ann,30,0,because_wsj_1506.ann_30_0,"Last week, Central Intelligence Agency Director William Webster publicly called on Congress to provide new interpretations of the assassination order that would permit the U.S. more freedom to act in coups.","Last week, Central Intelligence Agency Director William Webster publicly called on Congress to provide new interpretations of the assassination order <ARG0>that</ARG0> would permit <ARG1>the U.S. more freedom to act in coups</ARG1>.",0,0,,1
because,wsj_1506.ann,31,0,because_wsj_1506.ann_31_0,The administration has reacted to criticism that it mishandled the latest coup attempt by seeking to blame Congress for restrictions the White House said have hampered its freedom of action.,The administration has reacted to criticism that it mishandled the latest coup attempt by seeking to blame <ARG0>Congress</ARG0> for <ARG1>restrictions the White House said have hampered its freedom of action</ARG1>.,1,1,,1
because,wsj_1506.ann,31,1,because_wsj_1506.ann_31_1,The administration has reacted to criticism that it mishandled the latest coup attempt by seeking to blame Congress for restrictions the White House said have hampered its freedom of action.,The administration has reacted to criticism that it mishandled the latest coup attempt by seeking to blame Congress for <ARG0>restrictions</ARG0> the White House said have hampered <ARG1>its freedom of action</ARG1>.,1,1,,1
because,wsj_1506.ann,32,0,because_wsj_1506.ann_32_0,"However, last week Mr. Webster's two top CIA deputies said congressional curbs hadn't hampered the spy agency's role in the coup attempt in Panama.","However, last week Mr. Webster's two top CIA deputies said <ARG0>congressional curbs</ARG0> hadn't hampered <ARG1>the spy agency's role in the coup attempt in Panama</ARG1>.",1,1,,1
because,wsj_1506.ann,33,0,because_wsj_1506.ann_33_0,"Nevertheless, the administration's criticisms appeared to have made some headway with Sens. Boren and Cohen after their Oct. 12 meeting with the president.","Nevertheless, <ARG1>the administration's criticisms appeared to have made some headway with Sens. Boren and Cohen</ARG1> after <ARG0>their Oct. 12 meeting with the president</ARG0>.",0,0,,1
because,wsj_1506.ann,34,0,because_wsj_1506.ann_34_0,"The three men agreed to rewrite the guidelines, without changing the basic assassination ban, to clear up any ambiguities that may have hampered U.S. encouragement of coups against anti-American leaders.","<ARG1>The three men agreed to rewrite the guidelines, without changing the basic assassination ban</ARG1>, to <ARG0>clear up any ambiguities that may have hampered U.S. encouragement of coups against anti-American leaders</ARG0>.",1,1,,1
because,wsj_1506.ann,34,1,because_wsj_1506.ann_34_1,"The three men agreed to rewrite the guidelines, without changing the basic assassination ban, to clear up any ambiguities that may have hampered U.S. encouragement of coups against anti-American leaders.","The three men agreed to rewrite the guidelines, without changing the basic assassination ban, to clear up any ambiguities <ARG0>that</ARG0> may have hampered <ARG1>U.S. encouragement of coups against anti-American leaders</ARG1>.",1,1,,1
because,wsj_1506.ann,11,1,because_wsj_1506.ann_11_1,"It has reopened the bitter wrangling between the White House and Congress over who is responsible for the failure to oust Mr. Noriega and, more broadly, for difficulties in carrying out covert activities abroad.","It has reopened the bitter wrangling between the White House and Congress over <ARG0>who</ARG0> is responsible for the failure to oust Mr. Noriega and, more broadly, for <ARG1>difficulties in carrying out covert activities abroad</ARG1>.",1,1,,1
because,wsj_1506.ann,15,0,because_wsj_1506.ann_15_0,"Sen. Boren said, ""It's time to stop bickering and work together to develop a clear and appropriate policy to help the country in the future.","Sen. Boren said, ""It's time to stop bickering and <ARG1>work together</ARG1> to <ARG0>develop a clear and appropriate policy to help the country in the future</ARG0>.",1,1,,1
because,wsj_1540.ann,5,0,because_wsj_1540.ann_5_0,Ford and Saab ended talks about a possible alliance after Ford concluded that the cost to modernize Saab's car operations would outweigh the likely return.,<ARG1>Ford and Saab ended talks about a possible alliance</ARG1> after <ARG0>Ford concluded that the cost to modernize Saab's car operations would outweigh the likely return</ARG0>.,1,1,,1
because,wsj_1540.ann,6,0,because_wsj_1540.ann_6_0,"The collapse Friday prompted speculation that Ford would intensify its pursuit of Jaguar, which is negotiating a defensive alliance with GM.","<ARG0>The collapse Friday</ARG0> prompted <ARG1>speculation that Ford would intensify its pursuit of Jaguar, which is negotiating a defensive alliance with GM</ARG1>.",1,1,,1
because,wsj_1540.ann,8,0,because_wsj_1540.ann_8_0,"The Dow Jones industrials rose 5.94, to 2689.14, making the gain for the week a record 119.88 points, or 4.7%.","<ARG0>The Dow Jones industrials rose 5.94, to 2689.14</ARG0>, making <ARG1>the gain for the week a record 119.88 points, or 4.7%</ARG1>.",1,1,,1
because,wsj_1540.ann,14,0,because_wsj_1540.ann_14_0,OPEC officials worry that prices could collapse a few months from now if the group doesn't adopt new quotas.,OPEC officials worry that <ARG1>prices could collapse a few months from now</ARG1> if <ARG0>the group doesn't adopt new quotas</ARG0>.,1,1,,1
because,wsj_1540.ann,16,0,because_wsj_1540.ann_16_0,"The proposals, from suitors including Interpublic Group, come as the London-based ad giant struggles through its most difficult period ever.","<ARG1>The proposals, from suitors including Interpublic Group, come</ARG1> as <ARG0>the London-based ad giant struggles through its most difficult period ever</ARG0>.",1,1,,1
because,wsj_1540.ann,17,0,because_wsj_1540.ann_17_0,Qintex Australia suffered another setback Friday when its Los Angeles-based affiliate filed for Chapter 11 protection.,<ARG1>Qintex Australia suffered another setback Friday</ARG1> when <ARG0>its Los Angeles-based affiliate filed for Chapter 11 protection</ARG0>.,0,0,,1
because,wsj_1540.ann,24,0,because_wsj_1540.ann_24_0,It is Texaco's first major acquisition since the legal battle with Pennzoil began over four years ago.,<ARG1>It is Texaco's first major acquisition</ARG1> since <ARG0>the legal battle with Pennzoil began over four years ago</ARG0>.,0,0,,1
because,wsj_1540.ann,10,0,because_wsj_1540.ann_10_0,New York City bonds were sold off by many investors last week amid political and economic uncertainty.,<ARG1>New York City bonds were sold off by many investors last week</ARG1> amid <ARG0>political and economic uncertainty</ARG0>.,1,1,,1
because,wsj_1545.ann,1,0,because_wsj_1545.ann_1_0,"PAPERS: Management and unions representing 2,400 employees at Torstar Corp. 's Toronto Star reached a tentative contract agreement Friday, averting a strike by most employees of Canada's largest daily newspaper.","PAPERS: <ARG0>Management and unions representing 2,400 employees at Torstar Corp. 's Toronto Star reached a tentative contract agreement Friday</ARG0>, averting <ARG1>a strike by most employees of Canada's largest daily newspaper</ARG1>.",1,1,,1
because,wsj_1603.ann,2,0,because_wsj_1603.ann_2_0,"After years of hesitation, economic and political reform was embraced at the end of 1986, but ringing declarations have yet to be translated into much action.","After <ARG0>years of hesitation</ARG0>, <ARG1>economic and political reform was embraced at the end of 1986</ARG1>, but ringing declarations have yet to be translated into much action.",0,0,,1
because,wsj_1603.ann,2,1,because_wsj_1603.ann_2_1,"After years of hesitation, economic and political reform was embraced at the end of 1986, but ringing declarations have yet to be translated into much action.","After years of hesitation, <ARG1>economic and political reform was embraced</ARG1> at <ARG0>the end of 1986</ARG0>, but ringing declarations have yet to be translated into much action.",0,0,,1
because,wsj_1603.ann,8,0,because_wsj_1603.ann_8_0,His business success made him an official target in pre-reform days.,<ARG0>His business success</ARG0> made <ARG1>him an official target in pre-reform days</ARG1>.,1,1,,1
because,wsj_1603.ann,12,0,because_wsj_1603.ann_12_0,"For his troubles, Mr. Chan was jailed three times between 1960 and 1974.","For <ARG0>his troubles</ARG0>, <ARG1>Mr. Chan was jailed three times between 1960 and 1974</ARG1>.",1,1,,1
because,wsj_1603.ann,15,0,because_wsj_1603.ann_15_0,"Things were supposed to change when Vietnam's economic reforms gathered pace, and for awhile they did.","<ARG1>Things were supposed to change</ARG1> when <ARG0>Vietnam's economic reforms gathered pace</ARG0>, and for awhile they did.",1,1,,1
because,wsj_1603.ann,16,0,because_wsj_1603.ann_16_0,"After years of experimenting, Mr. Chan produced a heavy-duty bicycle tire that outlasted its state-produced rival.","After <ARG0>years of experimenting</ARG0>, <ARG1>Mr. Chan produced a heavy-duty bicycle tire that outlasted its state-produced rival</ARG1>.",1,1,,1
because,wsj_1603.ann,21,0,because_wsj_1603.ann_21_0,"He was further questioned to determine if he was ""a real working man or an exploiter."" Says Mr. Chan: ""When I showed it was from my own brain, they lost for the second time.""","<ARG1>He was further questioned</ARG1> to <ARG0>determine if he was ""a real working man or an exploiter.""</ARG0> Says Mr. Chan: ""When I showed it was from my own brain, they lost for the second time.""",1,1,,1
because,wsj_1603.ann,21,1,because_wsj_1603.ann_21_1,"He was further questioned to determine if he was ""a real working man or an exploiter."" Says Mr. Chan: ""When I showed it was from my own brain, they lost for the second time.""","He was further questioned to determine if he was ""a real working man or an exploiter."" Says Mr. Chan: ""When <ARG0>I showed it was from my own brain</ARG0>, <ARG1>they lost for the second time</ARG1>.""",1,1,,1
because,wsj_1603.ann,24,0,because_wsj_1603.ann_24_0,His family was given three hours to leave before the house and contents were confiscated.,<ARG0>His family was given three hours to leave</ARG0> before <ARG1>the house and contents were confiscated</ARG1>.,0,0,,1
because,wsj_1603.ann,26,0,because_wsj_1603.ann_26_0,"After six months on the run, Mr. Chan learned the order for his arrest had been canceled.","After <ARG0>six months on the run</ARG0>, <ARG1>Mr. Chan learned the order for his arrest had been canceled</ARG1>.",0,0,,1
because,wsj_1603.ann,29,0,because_wsj_1603.ann_29_0,Mr. Chan achieved a breakthrough in 1987 -- and became a minor celebrity again -- when his story was published in a weekly newspaper.,<ARG1>Mr. Chan achieved a breakthrough in 1987 -- and became a minor celebrity again</ARG1> -- when <ARG0>his story was published in a weekly newspaper</ARG0>.,1,1,,1
because,wsj_1603.ann,30,0,because_wsj_1603.ann_30_0,"In 1988, 18 months after the sixth congress formally endorsed family-run private enterprise, district authorities allowed Mr. Chan to resume work.","In 1988, 18 months after <ARG0>the sixth congress formally endorsed family-run private enterprise</ARG0>, <ARG1>district authorities allowed Mr. Chan to resume work</ARG1>.",1,1,,1
because,wsj_1603.ann,30,1,because_wsj_1603.ann_30_1,"In 1988, 18 months after the sixth congress formally endorsed family-run private enterprise, district authorities allowed Mr. Chan to resume work.","In 1988, 18 months after the sixth congress formally endorsed family-run private enterprise, <ARG0>district authorities</ARG0> allowed <ARG1>Mr. Chan</ARG1> to <ARG1>resume work</ARG1>.",1,1,,1
because,wsj_1603.ann,32,0,because_wsj_1603.ann_32_0,National leaders stopped by his stand to commend his achievements.,<ARG1>National leaders stopped by his stand</ARG1> to <ARG0>commend his achievements</ARG0>.,1,1,,1
because,wsj_1603.ann,40,0,because_wsj_1603.ann_40_0,"When district authorities allowed him to resume manufacturing, they released only one of his machines.","When <ARG0>district authorities allowed him to resume manufacturing</ARG0>, <ARG1>they released only one of his machines</ARG1>.",1,0,,1
because,wsj_1603.ann,40,1,because_wsj_1603.ann_40_1,"When district authorities allowed him to resume manufacturing, they released only one of his machines.","When <ARG0>district authorities</ARG0> allowed <ARG1>him</ARG1> to <ARG1>resume manufacturing</ARG1>, they released only one of his machines.",1,1,,1
because,wsj_1603.ann,46,0,because_wsj_1603.ann_46_0,"Nguyen Ngoc seemed an obvious choice when the Vietnamese Writers Association was looking for a new editor to reform its weekly newspaper, Van Nghe.","<ARG1>Nguyen Ngoc seemed an obvious choice</ARG1> when <ARG0>the Vietnamese Writers Association was looking for a new editor to reform its weekly newspaper, Van Nghe</ARG0>.",0,0,,1
because,wsj_1603.ann,47,0,because_wsj_1603.ann_47_0,"After the sixth congress, journalists seized the opportunity provided by the liberalization to probe previously taboo subjects.","After <ARG0>the sixth congress</ARG0>, <ARG1>journalists seized the opportunity provided by the liberalization to probe previously taboo subjects</ARG1>.",0,0,,1
because,wsj_1603.ann,48,0,because_wsj_1603.ann_48_0,"Mr. Ngoc, 57 years old, had solid reformist credentials: He had lost his official position in the association in he early 1980s because he questioned the intrusion of politics into literature.","Mr. Ngoc, 57 years old, had solid reformist credentials: <ARG1>He had lost his official position in the association in he early 1980s</ARG1> because <ARG0>he questioned the intrusion of politics into literature</ARG0>.",1,1,,1
because,wsj_1603.ann,50,0,because_wsj_1603.ann_50_0,Circulation soared as the weekly went way beyond standard literary themes to cover Vietnamese society and its ills.,<ARG1>Circulation soared</ARG1> as <ARG0>the weekly went way beyond standard literary themes to cover Vietnamese society and its ills</ARG0>.,1,1,,1
because,wsj_1603.ann,54,0,because_wsj_1603.ann_54_0,"The newspaper also ran a series of controversial short stories by Nguyen Huy Thiep, a former history teacher, who stirred debate over his interpretation of Vietnamese culture and took a thinly veiled swipe at writers who had blocked his entry into their official association.","The newspaper also ran a series of controversial short stories by Nguyen Huy Thiep, a former history teacher, who stirred debate over his interpretation of Vietnamese culture and took a thinly veiled swipe at writers <ARG0>who</ARG0> had blocked <ARG1>his entry into their official association</ARG1>.",1,1,,1
because,wsj_1603.ann,56,0,because_wsj_1603.ann_56_0,"After months of internal rumblings, Mr. Ngoc was fired last December.","After <ARG0>months of internal rumblings</ARG0>, <ARG1>Mr. Ngoc was fired last December</ARG1>.",0,0,,1
because,wsj_1603.ann,57,0,because_wsj_1603.ann_57_0,His dismissal triggered a furor among intellectuals that continues today.,<ARG0>His dismissal</ARG0> triggered <ARG1>a furor among intellectuals that continues today</ARG1>.,1,1,,1
because,wsj_1603.ann,59,0,because_wsj_1603.ann_59_0,"For the leadership, that was too painful to bear.""","For the leadership, that was <ARG0>too painful</ARG0> to <ARG1>bear</ARG1>.""",1,1,,1
because,wsj_1603.ann,65,0,because_wsj_1603.ann_65_0,"Her success, which included alleviating an urban food shortage in the early 1980s, helped persuade Hanoi to take the reform path.","<ARG0>Her success, which included alleviating an urban food shortage in the early 1980s</ARG0>, helped <ARG1>persuade Hanoi to take the reform path</ARG1>.",1,1,,1
because,wsj_1603.ann,67,0,because_wsj_1603.ann_67_0,"A lifelong revolutionary with little education who fought both the French and the U.S.-backed Saigon regime, she switched effortlessly to commerce after the war.","<ARG1>A lifelong revolutionary with little education who fought both the French and the U.S.-backed Saigon regime, she switched effortlessly to commerce</ARG1> after <ARG0>the war</ARG0>.",0,0,,1
because,wsj_1603.ann,69,0,because_wsj_1603.ann_69_0,"As she rode over regulations, only her friendship with party leaders, including Nguyen Van Linh, then Ho Chi Minh City party secretary, kept her out of jail.","As <ARG0>she rode over regulations</ARG0>, <ARG1>only her friendship with party leaders, including Nguyen Van Linh, then Ho Chi Minh City party secretary, kept her out of jail</ARG1>.",0,0,,1
because,wsj_1603.ann,71,0,because_wsj_1603.ann_71_0,"The authorities have steered foreign reporters to her office to see an example of ""the new way of thinking.""","<ARG1>The authorities have steered foreign reporters to her office</ARG1> to <ARG0>see an example of ""the new way of thinking.""</ARG0>",1,1,,1
because,wsj_1603.ann,83,0,because_wsj_1603.ann_83_0,"She is almost cavalier about the possibility Vietnam's reforms will create rivals on her home turf. ""I don't mind the competition inside the country,"" she says. ""I am only afraid that with Vietnam's poor-quality products we can't compete with neighboring countries.""","She is almost cavalier about the possibility <ARG0>Vietnam's reforms</ARG0> will create <ARG1>rivals on her home turf</ARG1>. ""I don't mind the competition inside the country,"" she says. ""I am only afraid that with Vietnam's poor-quality products we can't compete with neighboring countries.""",1,1,,1
because,wsj_1603.ann,83,1,because_wsj_1603.ann_83_1,"She is almost cavalier about the possibility Vietnam's reforms will create rivals on her home turf. ""I don't mind the competition inside the country,"" she says. ""I am only afraid that with Vietnam's poor-quality products we can't compete with neighboring countries.""","She is almost cavalier about the possibility Vietnam's reforms will create rivals on her home turf. ""I don't mind the competition inside the country,"" she says. ""I am only afraid that with <ARG0>Vietnam's poor-quality products</ARG0> <ARG1>we can't compete with neighboring countries</ARG1>.""",1,1,,1
because,wsj_1603.ann,70,0,because_wsj_1603.ann_70_0,"Following Mr. Linh's appointment as secretary-general of the party at the sixth congress, Mrs. Thi has become the darling of ""doi moi"", the Vietnamese version of perestroika.","Following <ARG0>Mr. Linh's appointment as secretary-general of the party at the sixth congress</ARG0>, <ARG1>Mrs. Thi has become the darling of ""doi moi"", the Vietnamese version of perestroika</ARG1>.",1,1,,1
because,wsj_1611.ann,1,0,because_wsj_1611.ann_1_0,"As the Hunt brothers' personal bankruptcy cases sputter into their second year, Minpeco S.A. has proposed a deal to settle its huge claim against the troubled Texas oil men.","As <ARG0>the Hunt brothers' personal bankruptcy cases sputter into their second year</ARG0>, <ARG1>Minpeco S.A. has proposed a deal to settle its huge claim against the troubled Texas oil men</ARG1>.",0,0,,1
because,wsj_1611.ann,3,0,because_wsj_1611.ann_3_0,The Peruvian mineral concern's $251 million claim stems from 1988 jury award in a case stemming from the brothers' alleged attempts to corner the 1979-80 silver market.,<ARG1>The Peruvian mineral concern's $251 million claim</ARG1> stems from <ARG0>1988 jury award in a case stemming from the brothers' alleged attempts to corner the 1979-80 silver market</ARG0>.,1,1,,1
because,wsj_1611.ann,3,1,because_wsj_1611.ann_3_1,The Peruvian mineral concern's $251 million claim stems from 1988 jury award in a case stemming from the brothers' alleged attempts to corner the 1979-80 silver market.,The Peruvian mineral concern's $251 million claim stems from 1988 jury award in <ARG1>a case</ARG1> stemming from <ARG0>the brothers' alleged attempts to corner the 1979-80 silver market</ARG0>.,1,1,,1
because,wsj_1611.ann,6,0,because_wsj_1611.ann_6_0,"Nelson Bunker Hunt is considering it, although his attorney says he won't do it if the proposal jeopardizes a tentative settlement he has reached with the Internal Revenue Service, which claims the brothers owe $1 billion in back taxes and is by far the biggest creditor in both cases.","Nelson Bunker Hunt is considering it, although his attorney says <ARG1>he won't do it</ARG1> if <ARG0>the proposal jeopardizes a tentative settlement he has reached with the Internal Revenue Service, which claims the brothers owe $1 billion in back taxes and is by far the biggest creditor in both cases</ARG0>.",1,1,,1
because,wsj_1611.ann,11,0,because_wsj_1611.ann_11_0,"With support from the IRS, Manufacturers Hanover has filed suit asking Judge Abramson to subordinate Minpeco's claim to those of Manufacturer Hanover and the IRS. Minpeco has threatened a ""volcano"" of litigation if the Manufacturers Hanover Corp. unit attempts to force such a plan through the court.","With support from the IRS, Manufacturers Hanover has filed suit asking Judge Abramson to subordinate Minpeco's claim to those of Manufacturer Hanover and the IRS. Minpeco has threatened <ARG1>a ""volcano"" of litigation</ARG1> if <ARG0>the Manufacturers Hanover Corp. unit attempts to force such a plan through the court</ARG0>.",1,1,,1
because,wsj_1611.ann,12,0,because_wsj_1611.ann_12_0,"Minpeco said it wouldn't pursue such litigation if its settlement plan in the W. Herbert Hunt case is approved by Judge Abramson, who will consider the proposal at a hearing next week.","Minpeco said <ARG1>it wouldn't pursue such litigation</ARG1> if <ARG0>its settlement plan in the W. Herbert Hunt case is approved by Judge Abramson, who will consider the proposal at a hearing next week</ARG0>.",1,1,,1
because,wsj_1611.ann,14,0,because_wsj_1611.ann_14_0,"""The thing is so fluid right now that there's really no way to say what will happen,"" says Justice Department attorney Grover Hartt III, who represents the IRS in the case. ""Developments like this are hard to predict.""","""The thing is <ARG0>so fluid right now</ARG0> that <ARG1>there's really no way to say what will happen</ARG1>,"" says Justice Department attorney Grover Hartt III, who represents the IRS in the case. ""Developments like this are hard to predict.""",1,1,,1
because,wsj_1628.ann,7,0,because_wsj_1628.ann_7_0,"The decision is a setback for President Bush, who needs the support of Democrats to pass the tax cut through the Democratic-controlled Senate.","The decision is a setback for President Bush, who needs <ARG0>the support of Democrats</ARG0> to <ARG1>pass the tax cut through the Democratic-controlled Senate</ARG1>.",1,1,,1
because,wsj_1628.ann,9,0,because_wsj_1628.ann_9_0,Having only a Republican measure makes the task harder.,<ARG0>Having only a Republican measure</ARG0> makes <ARG1>the task harder</ARG1>.,1,1,,1
because,wsj_1628.ann,11,0,because_wsj_1628.ann_11_0,He said a clear majority of senators back the tax reduction and that ultimately there would be enough senators to overcome any procedural hurdle the Democratic leadership might erect.,He said a clear majority of senators back the tax reduction and that ultimately there would be <ARG0>enough senators</ARG0> to <ARG1>overcome any procedural hurdle the Democratic leadership might erect</ARG1>.,1,1,,1
because,wsj_1628.ann,14,0,because_wsj_1628.ann_14_0,"Yesterday, in an interview, he added that the Democrats' decision ""increases the likelihood that a capital-gains tax cut will not pass this year."" Mr. Mitchell's first victory came last week, when the Senate passed a deficit-reduction bill that didn't contain a capital-gains provision.","Yesterday, in an interview, he added that the Democrats' decision ""increases the likelihood that a capital-gains tax cut will not pass this year."" Mr. Mitchell's first victory came <ARG1>last week</ARG1>, when <ARG0>the Senate passed a deficit-reduction bill that didn't contain a capital-gains provision</ARG0>.",0,0,,1
because,wsj_1628.ann,15,0,because_wsj_1628.ann_15_0,"That vote made it unlikely that a capital-gains tax cut would be included in the final bill, now being drafted by House and Senate negotiators.","<ARG0>That vote</ARG0> made <ARG1>it unlikely that a capital-gains tax cut would be included in the final bill, now being drafted by House and Senate negotiators</ARG1>.",1,1,,1
because,wsj_1628.ann,18,0,because_wsj_1628.ann_18_0,"To help lay the groundwork for that fight, President Bush plans early next week to meet at the White House with some 20 Democratic senators who favor cutting the capital-gains tax or are undecided on the issue.","To <ARG0>help lay the groundwork for that fight</ARG0>, <ARG1>President Bush plans early next week to meet at the White House with some 20 Democratic senators who favor cutting the capital-gains tax or are undecided on the issue</ARG1>.",1,1,,1
