corpus,doc_id,sent_id,eg_id,index,text,text_w_pairs,seq_label,pair_label,context,num_sents
because,CHRG-110hhrg44900-2.ann,218,0,because_CHRG-110hhrg44900-2.ann_218_0,"The first is supervisory oversight of those institutions to make sure that they are in fact doing what they need to do to be safe and sound, are not taking advantage of the implicit backstop.","The first is <ARG1>supervisory oversight of those institutions</ARG1> to <ARG0>make sure that they are in fact doing what they need to do to be safe and sound, are not taking advantage of the implicit backstop</ARG0>.",1,1,,1
because,CHRG-110hhrg44900-2.ann,218,1,because_CHRG-110hhrg44900-2.ann_218_1,"The first is supervisory oversight of those institutions to make sure that they are in fact doing what they need to do to be safe and sound, are not taking advantage of the implicit backstop.","The first is supervisory oversight of those institutions to make sure that they are in fact doing what they need to <ARG0>do</ARG0> to <ARG1>be safe and sound</ARG1>, are not taking advantage of the implicit backstop.",1,1,,1
because,CHRG-110hhrg44900-2.ann,221,0,because_CHRG-110hhrg44900-2.ann_221_0,"Second, as Secretary Paulson mentioned, if we can strengthen our infrastructure sufficiently so that it could absorb the failure of a large firm--we felt it wasn't able to do so in March.","Second, as Secretary Paulson mentioned, if <ARG1>we can strengthen our infrastructure sufficiently</ARG1> so that <ARG0>it could absorb the failure of a large firm</ARG0>--we felt it wasn't able to do so in March.",1,1,,1
because,CHRG-110hhrg44900-2.ann,222,0,because_CHRG-110hhrg44900-2.ann_222_0,"But if it were clearer that the system could withstand the failure of a firm of Bear Stearns' size, then we would be much more comfortable letting it happen, because we would think the system would be preserved.","But if <ARG0>it were clearer that the system could withstand the failure of a firm of Bear Stearns' size</ARG0>, then <ARG1>we would be much more comfortable letting it happen, because we would think the system would be preserved</ARG1>.",1,1,,1
because,CHRG-110hhrg44900-2.ann,222,1,because_CHRG-110hhrg44900-2.ann_222_1,"But if it were clearer that the system could withstand the failure of a firm of Bear Stearns' size, then we would be much more comfortable letting it happen, because we would think the system would be preserved.","But if it were clearer that the system could withstand the failure of a firm of Bear Stearns' size, then <ARG1>we would be much more comfortable letting it happen</ARG1>, because <ARG0>we would think the system would be preserved</ARG0>.",1,1,,1
because,CHRG-110hhrg44900-2.ann,223,0,because_CHRG-110hhrg44900-2.ann_223_0,"And finally, I think that, as has happened in the commercial banking world, we do have stronger resolution procedures that would allow us to intervene in an early stage perhaps and to try to create an orderly process that doesn't create the market externalities at the same time it would avoid moral hazard because the equity holders, the management and subordinate debt holders would all be subjected to losses in that process.","And finally, I think that, as has happened in the commercial banking world, we do have stronger resolution procedures <ARG0>that</ARG0> would allow <ARG1>us</ARG1> to <ARG1>intervene in an early stage</ARG1> perhaps and to try to create an orderly process that doesn't create the market externalities at the same time it would avoid moral hazard because the equity holders, the management and subordinate debt holders would all be subjected to losses in that process.",1,1,,1
because,CHRG-110hhrg44900-2.ann,223,1,because_CHRG-110hhrg44900-2.ann_223_1,"And finally, I think that, as has happened in the commercial banking world, we do have stronger resolution procedures that would allow us to intervene in an early stage perhaps and to try to create an orderly process that doesn't create the market externalities at the same time it would avoid moral hazard because the equity holders, the management and subordinate debt holders would all be subjected to losses in that process.","And finally, I think that, as has happened in the commercial banking world, we do have stronger resolution procedures <ARG0>that</ARG0> would allow us to intervene in an early stage perhaps and to <ARG1>try to create an orderly process that doesn't create the market externalities at the same time it would avoid moral hazard because the equity holders, the management and subordinate debt holders would all be subjected to losses in that process</ARG1>.",1,1,,1
because,CHRG-110hhrg44900-2.ann,223,2,because_CHRG-110hhrg44900-2.ann_223_2,"And finally, I think that, as has happened in the commercial banking world, we do have stronger resolution procedures that would allow us to intervene in an early stage perhaps and to try to create an orderly process that doesn't create the market externalities at the same time it would avoid moral hazard because the equity holders, the management and subordinate debt holders would all be subjected to losses in that process.","And finally, I think that, as has happened in the commercial banking world, we do have stronger resolution procedures that would allow us to intervene in an early stage perhaps and to try to create an orderly process that doesn't create the market externalities at the same time <ARG0>it</ARG0> would avoid <ARG1>moral hazard</ARG1> because the equity holders, the management and subordinate debt holders would all be subjected to losses in that process.",1,1,,1
because,CHRG-110hhrg44900-2.ann,223,3,because_CHRG-110hhrg44900-2.ann_223_3,"And finally, I think that, as has happened in the commercial banking world, we do have stronger resolution procedures that would allow us to intervene in an early stage perhaps and to try to create an orderly process that doesn't create the market externalities at the same time it would avoid moral hazard because the equity holders, the management and subordinate debt holders would all be subjected to losses in that process.","And finally, I think that, as has happened in the commercial banking world, we do have stronger resolution procedures that would allow us to intervene in an early stage perhaps and to try to create an orderly process <ARG0>that</ARG0> doesn't create <ARG1>the market externalities</ARG1> at the same time it would avoid moral hazard because the equity holders, the management and subordinate debt holders would all be subjected to losses in that process.",1,1,,1
because,CHRG-110hhrg44900-2.ann,233,0,because_CHRG-110hhrg44900-2.ann_233_0,"It's clear from recent events that many expected synergies of financial service activities, whatever benefits that they gave during times of economic prosperity, gave rise to conflicts and excessive risk taking.","It's clear from recent events that <ARG0>many expected synergies of financial service activities, whatever benefits that they gave during times of economic prosperity</ARG0>, gave rise to <ARG1>conflicts and excessive risk taking</ARG1>.",1,1,,1
because,CHRG-110hhrg44900-2.ann,234,0,because_CHRG-110hhrg44900-2.ann_234_0,It appears that many firms are in so many lines of businesses that conflicts and excessive risk arise.,It appears that many firms are in <ARG0>so many lines of businesses</ARG0> that <ARG1>conflicts and excessive risk arise</ARG1>.,1,1,,1
because,CHRG-110hhrg44900-2.ann,236,0,because_CHRG-110hhrg44900-2.ann_236_0,"For example, some have said Bear Stearns' trading operation may have caused risk to its clearing operations.","For example, some have said <ARG0>Bear Stearns' trading operation</ARG0> may have caused <ARG1>risk to its clearing operations</ARG1>.",1,1,,1
because,CHRG-110hhrg44900-2.ann,249,0,because_CHRG-110hhrg44900-2.ann_249_0,"I believe that the biggest problems we are dealing with is not the diversification of these organizations but it is the amount of risk that was taken on, and the amount of leverage, much greater than was understood, because a lot of it was taken on through complex products that were difficult to understand.","I believe that the biggest problems we are dealing with is not the diversification of these organizations but it is the amount of risk that was taken on, and the amount of leverage, <ARG1>much greater than was understood</ARG1>, because <ARG0>a lot of it was taken on through complex products that were difficult to understand</ARG0>.",1,1,,1
because,CHRG-110hhrg44900-2.ann,250,0,because_CHRG-110hhrg44900-2.ann_250_0,And that's why it's taking so long to work through this.,And <ARG0>that</ARG0>'s why <ARG1>it's taking so long to work through this</ARG1>.,1,1,,1
because,CHRG-110hhrg44900-2.ann,264,0,because_CHRG-110hhrg44900-2.ann_264_0,And we are also trying to do a better job of our consolidated supervision whereby we focus not just on the holding company but we make sure that we interact more intensively with the functional regulators of the subsidiaries or the affiliates.,And we are also trying to do a better job of our consolidated supervision whereby we focus not just on the holding company but <ARG0>we</ARG0> make sure that <ARG1>we interact more intensively with the functional regulators of the subsidiaries or the affiliates</ARG1>.,1,1,,1
because,CHRG-110hhrg44900-2.ann,271,0,because_CHRG-110hhrg44900-2.ann_271_0,"I'm delighted the two of you are here today because I might just get to the bottom of the question I have been asking for many years, which is, who is in charge of the dollar?","<ARG1>I'm delighted the two of you are here today</ARG1> because <ARG0>I might just get to the bottom of the question I have been asking for many years, which is, who is in charge of the dollar</ARG0>?",1,1,,1
because,CHRG-110hhrg44900-2.ann,273,0,because_CHRG-110hhrg44900-2.ann_273_0,"I do want to acknowledge the gentleman from New Jersey, Mr. Garrett, for playing a part in bringing these hearings about, and also Chairman Frank for having these hearings because I deeply appreciate it.","I do want to <ARG1>acknowledge the gentleman from New Jersey, Mr. Garrett</ARG1>, for <ARG0>playing a part in bringing these hearings about</ARG0>, and also Chairman Frank for having these hearings because I deeply appreciate it.",1,1,,1
because,CHRG-110hhrg44900-2.ann,273,1,because_CHRG-110hhrg44900-2.ann_273_1,"I do want to acknowledge the gentleman from New Jersey, Mr. Garrett, for playing a part in bringing these hearings about, and also Chairman Frank for having these hearings because I deeply appreciate it.","I do want to <ARG1>acknowledge</ARG1> the gentleman from New Jersey, Mr. Garrett, for playing a part in bringing these hearings about, and <ARG1>also Chairman Frank</ARG1> for <ARG0>having these hearings</ARG0> because I deeply appreciate it.",1,1,,1
because,CHRG-110hhrg44900-2.ann,273,2,because_CHRG-110hhrg44900-2.ann_273_2,"I do want to acknowledge the gentleman from New Jersey, Mr. Garrett, for playing a part in bringing these hearings about, and also Chairman Frank for having these hearings because I deeply appreciate it.","<ARG1>I do want to acknowledge the gentleman from New Jersey, Mr. Garrett, for playing a part in bringing these hearings about, and also Chairman Frank for having these hearings</ARG1> because <ARG0>I deeply appreciate it</ARG0>.",1,1,,1
because,CHRG-110hhrg44900-2.ann,274,0,because_CHRG-110hhrg44900-2.ann_274_0,"But I would like to take a minute to just challenge something he said during his questioning, because he made the flat statement that there was no alternative to the Federal Reserve system.","But <ARG1>I would like to take a minute to just challenge something he said during his questioning</ARG1>, because <ARG0>he made the flat statement that there was no alternative to the Federal Reserve system</ARG0>.",1,1,,1
because,CHRG-110hhrg44900-2.ann,282,0,because_CHRG-110hhrg44900-2.ann_282_0,"I would like to see a lot more regulations on the government and on the Federal Reserve, because I think it's the ability of the government, through regulatory agencies as well as the Federal Reserve, to disrupt markets and destroy market discipline.","<ARG1>I would like to see a lot more regulations on the government and on the Federal Reserve</ARG1>, because <ARG0>I think it's the ability of the government, through regulatory agencies as well as the Federal Reserve, to disrupt markets and destroy market discipline</ARG0>.",1,1,,1
because,CHRG-110hhrg44900-2.ann,284,0,because_CHRG-110hhrg44900-2.ann_284_0,"When Enron failed, we immediately said, well, it must have happened because we didn't have enough regulation, so Congress immediately responded by passing Sarbanes-Oxley.","When Enron failed, we immediately said, well, <ARG1>it must have happened</ARG1> because <ARG0>we didn't have enough regulation</ARG0>, so Congress immediately responded by passing Sarbanes-Oxley.",1,1,,1
because,CHRG-110hhrg44900-2.ann,284,1,because_CHRG-110hhrg44900-2.ann_284_1,"When Enron failed, we immediately said, well, it must have happened because we didn't have enough regulation, so Congress immediately responded by passing Sarbanes-Oxley.","When Enron failed, <ARG0>we immediately said, well, it must have happened because we didn't have enough regulation</ARG0>, so <ARG1>Congress immediately responded by passing Sarbanes-Oxley</ARG1>.",1,1,,1
because,CHRG-110hhrg44900-2.ann,290,0,because_CHRG-110hhrg44900-2.ann_290_0,And of course I maintain that they're in disarray because our monetary policy disrupts the markets because we create interest rates below market rates.,And of course I maintain that they're in disarray because <ARG1>our monetary policy disrupts the markets</ARG1> because <ARG0>we create interest rates below market rates</ARG0>.,1,1,,1
because,CHRG-110hhrg44900-2.ann,290,1,because_CHRG-110hhrg44900-2.ann_290_1,And of course I maintain that they're in disarray because our monetary policy disrupts the markets because we create interest rates below market rates.,And of course I maintain that <ARG1>they're in disarray</ARG1> because <ARG0>our monetary policy disrupts the markets because we create interest rates below market rates</ARG0>.,1,1,,1
because,CHRG-110hhrg44900-2.ann,294,0,because_CHRG-110hhrg44900-2.ann_294_0,"And we wonder why there are disruptions when you have artificially low interest rates, you cause the malinvestment, you cause excessive debt to accumulate, and you cause the bubbles to burst.","And we wonder why there are disruptions when you have artificially low interest rates, you cause the malinvestment, <ARG0>you</ARG0> cause <ARG1>excessive debt</ARG1> to <ARG1>accumulate</ARG1>, and you cause the bubbles to burst.",1,1,,1
because,CHRG-110hhrg44900-2.ann,294,1,because_CHRG-110hhrg44900-2.ann_294_1,"And we wonder why there are disruptions when you have artificially low interest rates, you cause the malinvestment, you cause excessive debt to accumulate, and you cause the bubbles to burst.","And we wonder why there are disruptions when you have artificially low interest rates, you cause the malinvestment, you cause excessive debt to accumulate, and <ARG0>you</ARG0> cause <ARG1>the bubbles</ARG1> to <ARG1>burst</ARG1>.",1,1,,1
because,CHRG-110hhrg44900-2.ann,308,0,because_CHRG-110hhrg44900-2.ann_308_0,"So my question is directed to Secretary Paulson dealing with the dollar, because evidently he is the spokesman and he is the champion of the dollar, and all public statements are that the dollar is to be strong.","So <ARG1>my question is directed to Secretary Paulson dealing with the dollar</ARG1>, because <ARG0>evidently he is the spokesman and he is the champion of the dollar, and all public statements are that the dollar is to be strong</ARG0>.",1,1,,1
because,CHRG-110hhrg44900-2.ann,294,2,because_CHRG-110hhrg44900-2.ann_294_2,"And we wonder why there are disruptions when you have artificially low interest rates, you cause the malinvestment, you cause excessive debt to accumulate, and you cause the bubbles to burst.","And we wonder why there are disruptions when you have artificially low interest rates, <ARG0>you</ARG0> cause <ARG1>the malinvestment</ARG1>, you cause excessive debt to accumulate, and you cause the bubbles to burst.",1,1,,1
because,CHRG-110hhrg44900-2.ann,43,3,because_CHRG-110hhrg44900-2.ann_43_3,And is there perhaps a need for extraordinary emergency legislation to empower either the Federal Reserve or Treasury to take certain actions to prevent systemic risk if over the next 9-month period the Congress is not able to act and you discern that the powers you have are not adequate to meet the challenges?,And is there perhaps a need for extraordinary emergency legislation to empower either the Federal Reserve or Treasury to take certain actions to prevent systemic risk if over the next 9-month period the Congress is not able to act and you discern that <ARG0>the powers you have</ARG0> are not adequate to <ARG1>meet the challenges</ARG1>?,1,1,,1
because,CHRG-110hhrg44900-2.ann,84,0,because_CHRG-110hhrg44900-2.ann_84_0,"Is there anything--and you probably have identified this in your testimony, but I must admit it's complicated enough for me to have trouble following.","Is there anything--and you probably have identified this in your testimony, but I must admit it's <ARG0>complicated enough</ARG0> for <ARG1>me</ARG1> to <ARG1>have trouble following</ARG1>.",1,1,,1
because,CHRG-110hhrg44900-2.ann,95,0,because_CHRG-110hhrg44900-2.ann_95_0,"It's just our sense, and of course you're in a better place than we are to make the judgment, that the more complex issues like resolution or even financial regulatory restructuring are simply not likely to happen in a short term, and we need to take the time to make sure it's done right and thoroughly worked through.","It's just our sense, and of course you're in a better place than we are to make the judgment, that the more complex issues like resolution or even financial regulatory restructuring are simply not likely to happen in a short term, and <ARG0>we</ARG0> need to take the time to make sure <ARG1>it's done right and thoroughly worked through</ARG1>.",1,1,,1
because,CHRG-110hhrg44900-2.ann,117,0,because_CHRG-110hhrg44900-2.ann_117_0,"And as I look at what can be done in terms of the timing the one thing we are not talking about a lot here, but I do believe we don't want to forget, is the fact that a lot of this problem came about as a result of sloppy and lax mortgage origination procedures.","And as I look at what can be done in terms of the timing the one thing we are not talking about a lot here, but I do believe we don't want to forget, is the fact that <ARG1>a lot of this problem came about</ARG1> as a result of <ARG0>sloppy and lax mortgage origination procedures</ARG0>.",1,1,,1
because,CHRG-110hhrg44900-2.ann,12,0,because_CHRG-110hhrg44900-2.ann_12_0,"Secretary Paulson:  I agree very much with what Chairman Bernanke has said, and I would just simply say that even if the structure isn't optimal and all of the authorities aren't optimal, regulators are working together seamlessly to address some of the issues that have arisen, and I think progress has been made.","Secretary Paulson:  I agree very much with what Chairman Bernanke has said, and I would just simply say that even if the structure isn't optimal and all of the authorities aren't optimal, <ARG1>regulators are working together seamlessly</ARG1> to <ARG0>address some of the issues that have arisen</ARG0>, and I think progress has been made.",1,1,,1
because,CHRG-110hhrg44900-2.ann,38,0,because_CHRG-110hhrg44900-2.ann_38_0,"Secretary Paulson, Chairman Bernanke, listening to your response to the chairman about timing, since last August of course all of us have examined and watched market failure occurring in various and sundry areas growing from subprime failure in August to what we call now a credit crisis.","Secretary Paulson, Chairman Bernanke, listening to your response to the chairman about timing, since <ARG0>last August</ARG0> of course <ARG1>all of us have examined and watched market failure occurring in various and sundry areas growing from subprime failure in August to what we call now a credit crisis</ARG1>.",0,0,,1
because,CHRG-110hhrg44900-2.ann,47,0,because_CHRG-110hhrg44900-2.ann_47_0,"We are dealing in a financial market that has evolved greatly since the time that many of our rules were put in place, that many of the--that the regulatory structure was set.","We are dealing in a financial market <ARG1>that has evolved greatly</ARG1> since <ARG0>the time that many of our rules were put in place, that many of the--that the regulatory structure was set</ARG0>.",0,0,,1
because,CHRG-110hhrg44900-2.ann,50,0,because_CHRG-110hhrg44900-2.ann_50_0,"But I will again say to you, even though this is a difficult period we are going through, and we both said that it's going to take some time to get through it, there will be some more bumps on the road, I really want to emphasize that you have seen the Federal Reserve, by opening up the discount window to the investment banks, through the Bear Stearns actions, to make a very strong statement about the importance of the stability of our financial system.","But I will again say to you, even though this is a difficult period we are going through, and we both said that it's going to take <ARG0>some time</ARG0> to <ARG1>get through it</ARG1>, there will be some more bumps on the road, I really want to emphasize that you have seen the Federal Reserve, by opening up the discount window to the investment banks, through the Bear Stearns actions, to make a very strong statement about the importance of the stability of our financial system.",0,0,,1
because,CHRG-110hhrg44900-2.ann,51,0,because_CHRG-110hhrg44900-2.ann_51_0,"And I have seen those investment banks working with the Fed and the SEC to strengthen their liquidity, strengthen their capital positions, and re-price risk.","And I have seen <ARG1>those investment banks working with the Fed and the SEC</ARG1> to <ARG0>strengthen their liquidity, strengthen their capital positions, and re-price risk</ARG0>.",1,1,,1
because,CHRG-110hhrg44900-2.ann,66,0,because_CHRG-110hhrg44900-2.ann_66_0,"Secretary Paulson:  Well, let me mention the student loans, because here is a case where I think you have seen our department work creatively with the Department of Education to deal with a problem that's here and now, and so we have a program in place which I think is going to be acceptable to most fellow lenders.","Secretary Paulson:  Well, let me mention the student loans, because here is a case where I think you have seen <ARG1>our department work creatively with the Department of Education</ARG1> to <ARG0>deal with a problem that's here and now</ARG0>, and so we have a program in place which I think is going to be acceptable to most fellow lenders.",1,1,,1
because,CHRG-110hhrg44900-2.ann,78,0,because_CHRG-110hhrg44900-2.ann_78_0,"When you're in Congress, you sort of think in terms of the next election or whatever it may be.","When <ARG0>you're in Congress</ARG0>, <ARG1>you sort of think in terms of the next election or whatever it may be</ARG1>.",1,1,,1
because,CHRG-110hhrg44900-2.ann,233,1,because_CHRG-110hhrg44900-2.ann_233_1,"It's clear from recent events that many expected synergies of financial service activities, whatever benefits that they gave during times of economic prosperity, gave rise to conflicts and excessive risk taking.","It's clear from recent events that many expected synergies of financial service activities, whatever benefits <ARG1>that they gave</ARG1> during <ARG0>times of economic prosperity</ARG0>, gave rise to conflicts and excessive risk taking.",1,0,,1
because,CHRG-110hhrg44900-2.ann,223,4,because_CHRG-110hhrg44900-2.ann_223_4,"And finally, I think that, as has happened in the commercial banking world, we do have stronger resolution procedures that would allow us to intervene in an early stage perhaps and to try to create an orderly process that doesn't create the market externalities at the same time it would avoid moral hazard because the equity holders, the management and subordinate debt holders would all be subjected to losses in that process.","And finally, I think that, as has happened in the commercial banking world, we do have stronger resolution procedures that would allow us to intervene in an early stage perhaps and to try to create an orderly process that doesn't create the market externalities at the same time <ARG1>it would avoid moral hazard</ARG1> because <ARG0>the equity holders, the management and subordinate debt holders would all be subjected to losses in that process</ARG0>.",1,1,,1
because,CHRG-110hhrg44900-2.ann,255,0,because_CHRG-110hhrg44900-2.ann_255_0,"Mrs. Maloney:  Absolutely, if time permits.","Mrs. Maloney:  <ARG1>Absolutely</ARG1>, if <ARG0>time permits</ARG0>.",1,1,,1
because,CHRG-110hhrg44900-2.ann,257,0,because_CHRG-110hhrg44900-2.ann_257_0,"The Chairman:  Well, the rule is that no member can ask questions after their 5 minutes is up, but if there is a question pending, we will take it.","The Chairman:  Well, the rule is that <ARG1>no member can ask questions</ARG1> after <ARG0>their 5 minutes is up</ARG0>, but if there is a question pending, we will take it.",1,1,,1
because,CHRG-110hhrg44900-2.ann,257,1,because_CHRG-110hhrg44900-2.ann_257_1,"The Chairman:  Well, the rule is that no member can ask questions after their 5 minutes is up, but if there is a question pending, we will take it.","The Chairman:  Well, the rule is that no member can ask questions after their 5 minutes is up, but if <ARG0>there is a question pending</ARG0>, <ARG1>we will take it</ARG1>.",1,1,,1
